{
  "requestId": "REQ-005",
  "decision": "ALLOW",
  "systemOutcome": "COMPLETED",
  "reasonCodes": [],
  "downstreamReached": true,
  "responseReleased": true,
  "success": true,
  "recordsRead": 1,
  "latencyMs": 120,
  "severity": "HIGH",
  "riskFlagged": true,
  "completedAt": "2026-08-17T21:32:11+09:00",
  "policyInput": {
    "behaviorRiskLevel": "CRITICAL",
    "behaviorAnomalyDetected": false,
    "hardRequestLimitExceeded": false,
    "approvalGranted": true
  }
}
